{
  "$schema": "../../../schemas/rules-cards.schema.json",
  "version": "1.0.0",
  "generatedAt": "2026-08-28",
  "act": {
    "id": "ol-act",
    "name": {
      "en": "Official Languages Act, 1963",
      "hi": "राजभाषा अधिनियम, 1963"
    },
    "short": {
      "en": "OL Act 1963",
      "hi": "राजभाषा अधिनियम"
    },
    "unit": {
      "en": "Section",
      "hi": "धारा"
    }
  },
  "disclaimer": {
    "en": "Reference only; verify with the official gazette/order or your DDO.",
    "hi": "केवल संदर्भ के लिए; आधिकारिक राजपत्र/आदेश अथवा अपने डीडीओ से सत्यापित करें।"
  },
  "source": {
    "name": "Department of Official Language, Ministry of Home Affairs — The Official Languages Act, 1963 (as amended, 1967)",
    "url": "https://rajbhasha.gov.in/sites/default/files/rajbhasha_act_1963e.pdf"
  },
  "cards": [
    {
      "id": "ol-act-rule-1",
      "act": "ol-act",
      "rule": "1",
      "kind": "rule",
      "front": {
        "en": "Short title and Commencement — which section of the OL Act 1963?",
        "hi": "संक्षिप्त नाम और प्रारंभ — राजभाषा अधिनियम का कौन-सा धारा?"
      },
      "back": {
        "en": "Section 1, Official Languages Act, 1963",
        "hi": "धारा 1, राजभाषा अधिनियम, 1963"
      },
      "ruleRef": {
        "textId": "ol-act-1",
        "citation": {
          "en": "Section 1, Official Languages Act, 1963",
          "hi": "धारा 1, राजभाषा अधिनियम, 1963"
        }
      },
      "difficulty": "easy",
      "reviewed": true,
      "reviewState": "approved",
      "tags": [
        "generated",
        "rule"
      ],
      "verify": true,
      "version": "1.0.0",
      "source": {
        "name": "Department of Official Language, Ministry of Home Affairs — The Official Languages Act, 1963 (as amended, 1967)",
        "url": "https://rajbhasha.gov.in/sites/default/files/rajbhasha_act_1963e.pdf"
      }
    },
    {
      "id": "ol-act-rule-2",
      "act": "ol-act",
      "rule": "2",
      "kind": "rule",
      "front": {
        "en": "Definitions — which section of the OL Act 1963?",
        "hi": "परिभाषाएँ — राजभाषा अधिनियम का कौन-सा धारा?"
      },
      "back": {
        "en": "Section 2, Official Languages Act, 1963",
        "hi": "धारा 2, राजभाषा अधिनियम, 1963"
      },
      "ruleRef": {
        "textId": "ol-act-2",
        "citation": {
          "en": "Section 2, Official Languages Act, 1963",
          "hi": "धारा 2, राजभाषा अधिनियम, 1963"
        }
      },
      "difficulty": "easy",
      "reviewed": true,
      "reviewState": "approved",
      "tags": [
        "generated",
        "rule"
      ],
      "verify": true,
      "version": "1.0.0",
      "source": {
        "name": "Department of Official Language, Ministry of Home Affairs — The Official Languages Act, 1963 (as amended, 1967)",
        "url": "https://rajbhasha.gov.in/sites/default/files/rajbhasha_act_1963e.pdf"
      }
    },
    {
      "id": "ol-act-rule-2-1",
      "act": "ol-act",
      "rule": "2",
      "subRule": "2(1)",
      "kind": "rule",
      "front": {
        "en": "Notwithstanding the expiration of the period of fifteen years from the commencement of the Constitution, the English language may, as from the appointed day, continue to be used in addition to … — which section?",
        "hi": ""
      },
      "back": {
        "en": "Section 2(1), Official Languages Act, 1963",
        "hi": "धारा 2(1), राजभाषा अधिनियम, 1963"
      },
      "ruleRef": {
        "textId": "ol-act-2",
        "citation": {
          "en": "Section 2(1), Official Languages Act, 1963",
          "hi": "धारा 2(1), राजभाषा अधिनियम, 1963"
        }
      },
      "difficulty": "medium",
      "reviewed": false,
      "reviewState": "needs-hindi",
      "tags": [
        "generated",
        "rule",
        "sub-rule"
      ],
      "verify": true,
      "version": "1.0.0",
      "source": {
        "name": "Department of Official Language, Ministry of Home Affairs — The Official Languages Act, 1963 (as amended, 1967)",
        "url": "https://rajbhasha.gov.in/sites/default/files/rajbhasha_act_1963e.pdf"
      }
    },
    {
      "id": "ol-act-rule-2-2",
      "act": "ol-act",
      "rule": "2",
      "subRule": "2(2)",
      "kind": "rule",
      "front": {
        "en": "Notwithstanding anything contained in sub-section (1) where Hindi or the English Language is used for purposes of communication- (i) between one Ministry or Department or office of the Central … — which section?",
        "hi": ""
      },
      "back": {
        "en": "Section 2(2), Official Languages Act, 1963",
        "hi": "धारा 2(2), राजभाषा अधिनियम, 1963"
      },
      "ruleRef": {
        "textId": "ol-act-2",
        "citation": {
          "en": "Section 2(2), Official Languages Act, 1963",
          "hi": "धारा 2(2), राजभाषा अधिनियम, 1963"
        }
      },
      "difficulty": "medium",
      "reviewed": false,
      "reviewState": "needs-hindi",
      "tags": [
        "generated",
        "rule",
        "sub-rule"
      ],
      "verify": true,
      "version": "1.0.0",
      "source": {
        "name": "Department of Official Language, Ministry of Home Affairs — The Official Languages Act, 1963 (as amended, 1967)",
        "url": "https://rajbhasha.gov.in/sites/default/files/rajbhasha_act_1963e.pdf"
      }
    },
    {
      "id": "ol-act-rule-2-3",
      "act": "ol-act",
      "rule": "2",
      "subRule": "2(3)",
      "kind": "rule",
      "front": {
        "en": "Notwithstanding anything contained in sub-section (1), both Hindi and the English language shall be used for- (i) resolutions, general orders, rules, notifications, administrative or other reports or … — which section?",
        "hi": ""
      },
      "back": {
        "en": "Section 2(3), Official Languages Act, 1963",
        "hi": "धारा 2(3), राजभाषा अधिनियम, 1963"
      },
      "ruleRef": {
        "textId": "ol-act-2",
        "citation": {
          "en": "Section 2(3), Official Languages Act, 1963",
          "hi": "धारा 2(3), राजभाषा अधिनियम, 1963"
        }
      },
      "difficulty": "medium",
      "reviewed": false,
      "reviewState": "needs-hindi",
      "tags": [
        "generated",
        "rule",
        "sub-rule"
      ],
      "verify": true,
      "version": "1.0.0",
      "source": {
        "name": "Department of Official Language, Ministry of Home Affairs — The Official Languages Act, 1963 (as amended, 1967)",
        "url": "https://rajbhasha.gov.in/sites/default/files/rajbhasha_act_1963e.pdf"
      }
    },
    {
      "id": "ol-act-rule-2-4",
      "act": "ol-act",
      "rule": "2",
      "subRule": "2(4)",
      "kind": "rule",
      "front": {
        "en": "Without prejudice to the provisions of sub-section (1) or sub-section (2) or sub-section (3), the Central Government may, by rules made under section 8, provide for the language or languages to be … — which section?",
        "hi": ""
      },
      "back": {
        "en": "Section 2(4), Official Languages Act, 1963",
        "hi": "धारा 2(4), राजभाषा अधिनियम, 1963"
      },
      "ruleRef": {
        "textId": "ol-act-2",
        "citation": {
          "en": "Section 2(4), Official Languages Act, 1963",
          "hi": "धारा 2(4), राजभाषा अधिनियम, 1963"
        }
      },
      "difficulty": "medium",
      "reviewed": false,
      "reviewState": "needs-hindi",
      "tags": [
        "generated",
        "rule",
        "sub-rule"
      ],
      "verify": true,
      "version": "1.0.0",
      "source": {
        "name": "Department of Official Language, Ministry of Home Affairs — The Official Languages Act, 1963 (as amended, 1967)",
        "url": "https://rajbhasha.gov.in/sites/default/files/rajbhasha_act_1963e.pdf"
      }
    },
    {
      "id": "ol-act-rule-2-5",
      "act": "ol-act",
      "rule": "2",
      "subRule": "2(5)",
      "kind": "rule",
      "front": {
        "en": "The provisions of clause (a) of sub-section (1), and the provisions of sub-section (2), sub-section (3) and sub-section (4) shall remain in force until resolutions for the discontinuance of the use … — which section?",
        "hi": ""
      },
      "back": {
        "en": "Section 2(5), Official Languages Act, 1963",
        "hi": "धारा 2(5), राजभाषा अधिनियम, 1963"
      },
      "ruleRef": {
        "textId": "ol-act-2",
        "citation": {
          "en": "Section 2(5), Official Languages Act, 1963",
          "hi": "धारा 2(5), राजभाषा अधिनियम, 1963"
        }
      },
      "difficulty": "medium",
      "reviewed": false,
      "reviewState": "needs-hindi",
      "tags": [
        "generated",
        "rule",
        "sub-rule"
      ],
      "verify": true,
      "version": "1.0.0",
      "source": {
        "name": "Department of Official Language, Ministry of Home Affairs — The Official Languages Act, 1963 (as amended, 1967)",
        "url": "https://rajbhasha.gov.in/sites/default/files/rajbhasha_act_1963e.pdf"
      }
    },
    {
      "id": "ol-act-rule-4",
      "act": "ol-act",
      "rule": "4",
      "kind": "rule",
      "front": {
        "en": "Committee on Official Language — which section of the OL Act 1963?",
        "hi": "राजभाषा संबंधी समिति — राजभाषा अधिनियम का कौन-सा धारा?"
      },
      "back": {
        "en": "Section 4, Official Languages Act, 1963",
        "hi": "धारा 4, राजभाषा अधिनियम, 1963"
      },
      "ruleRef": {
        "textId": "ol-act-4",
        "citation": {
          "en": "Section 4, Official Languages Act, 1963",
          "hi": "धारा 4, राजभाषा अधिनियम, 1963"
        }
      },
      "difficulty": "easy",
      "reviewed": true,
      "reviewState": "approved",
      "tags": [
        "generated",
        "rule"
      ],
      "verify": true,
      "version": "1.0.0",
      "source": {
        "name": "Department of Official Language, Ministry of Home Affairs — The Official Languages Act, 1963 (as amended, 1967)",
        "url": "https://rajbhasha.gov.in/sites/default/files/rajbhasha_act_1963e.pdf"
      }
    },
    {